Product Name,Price,Review Count,Rating
KIRJA AMR 100% Natural D Tan Pack For Tanning Removal &...,259,3.7,13
Lakmé Peach Milk Vit E Cream Moisturizer,239,4.4,36563
Vaseline intensive Care Deep Nourishing Body Lotion Moi...,225,4.5,576316
MUUCHSTAC Ocean for Men,194,4.1,353391
BOROPLUS Doodh Kesar Body Lotion,179,4.4,218627
deconstruct 10% Vitamin C Face serum ,416,4.1,12303
NIVEA Body Milk with Almond Oil Moisturizer for Very Dr...,281,4.5,147313
NIVEA Soft Moisturizing Cream for all skin type,247,4.5,315915
deconstruct Sunscreen - SPF 55+ PA+++ Lightweight Gel S...,297,4.2,34122
Fair & Lovely Advanced Multivitamin Face Cream,62,4.3,1208
mars by GHC Premium Derma Roller 0.5mm 540 Micro Needle...,179,3.7,9951
Cetaphil Mini Travel Pack for Sensitive Skin,180,4.1,1334
Vaseline intensive Care Deep Moisture Nourishing Body L...,321,4.5,576316
MUUCHSTAC Ocean for Men,294,4.1,353391
Dabur Gulabari Premium Rose Water 100% Natural Men & Wo...,234,4.5,28234
Clean & Clear Foaming Face wash 390ml,360,4.5,239353
AMR Beauty AMRBEAUTY ,299,3.3,24
MANCODE Charcoal Peel Off Mask for Men- 100gm,169,3.8,3780
POND's Super Light Gel Non-Sticky Fresh Feel Moisturise...,219,4.4,88115
POND's Bright Beauty with Niacinamide & vitamin B3 Face...,172,4.4,86153
DR.RASHEL Bamboo Charcoal Nose Strip With Natural Charc...,105,3.9,3102
Vaseline Deep Moisturizer,806,4.5,576316
HIMALAYA PURIFYING NEEM ,346,4.4,323394
Candid Activ Antiperspirant Powder,179,4.2,4316
Vaseline Intensive Care Cocoa Glow Nourishing Body Seru...,214,4.5,136795
NIVEA Cocoa Nourish oil in Lotion Moisturizer,302,4.5,111951
7 Days Stretch Marks Scar removal cream oil in during a...,220,3.7,5143
urbangabru Hair Removal Spray for Men,359,3.9,424
POND's Bright Beauty Facewash with Niacinamide,159,4.4,4074
The Derma Co 10% Niacinamide Face Serum For Acne Marks ...,203,4.1,87213
The Plant Fix Plix Jamun Active Acne Regime with Toner,683,4.3,191
Dermatouch Bye Bye Hyperpigmentation Cream ,278,3.8,1200
BOROPLUS Doodh Kesar Lotion 400ml - Pack of 2,359,4.4,218627
Everyuth Naturals Exfoliating Walnut Scrub,192,4.4,42540
MUUCHSTAC Ocean for Men,384,4.1,353391
The Derma Co Sunscreen - SPF 50 PA++++ 1% Hyaluronic Aq...,244,4.2,49971
mars by GHC Derma Roller for Hair and Beard Growth ,168,3.7,15964
OZONE D-Tan Facial Cleanser for Instant Tan Removal ,192,4.1,740
FAIR AND HANDSOME Long Lasting Radiance Cream,90,4.2,1135
Dot & Key Sunscreen - SPF 50 PA+++ Vitamin C+E Super Br...,333,4.3,37962
THE MAN COMPANY Derma Roller for Men ,439,4.2,679
deconstruct Oil Control Face wash 0.5% Salicylic Acid,254,4.1,1117
Parachute Advansed Deep Nourish Body Lotion,306,4.4,1134
BOROPLUS Aloe Vera Gel,100,4.4,10831
BIOTIQUE Morning Nectar Flawless Skin Moisturizer,220,4.4,219707
HIMALAYA PURIFYING ,536,4.4,323394
MAEERA 4X Natural 9' Size Strong Performance Ayurvedic ...,295,3.6,90
Namyaa Hair Removing Cream for Intimate Skin with After...,193,4.2,10300
Pilgrim 10% Vitamin C Face Serum-Brightens & Reduces Da...,199,4.2,4453
Lakmé Peach Milk VIT E Moisturise-Riser,195,4.4,120996
Cesaro Organics Rose Face Toner for Refreshing & Hydrat...,88,4.1,992
panthi Onychomycosis Nail growth & strong serum,141,3.7,470
Dot & Key Ceramides & Hyaluronic Barrier Repair Moistur...,296,4.3,23680
Mamaearth Vitamin C Body Lotion - Pack of 2 (400 ml * 2...,358,4.4,32253
Garnier Men Acno Fight,379,4.5,58598
POND's Light Moisturizer ,202,4.4,89104
Easymart Micro Needles (0.5mm) Derma Roller & Ice Rolle...,129,3.8,516
OZONE D-Tan - For Tan Removal. A Skin Brightening & Ta...,192,4,4406
Lakmé Peach Milk Vit E Cream Moisturizer,239,4.4,36563
OLAY Natural Aura Radiance Cream with Vitamin B3,189,4.3,14575
KEYA SETH AROMATHERAPY Skin Defence Orange Face & Body ...,182,4.3,2174
The Plant Fix Plix Pineapple Skin Care Gift Box for De-...,802,4.3,43
Mamaearth Ubtan Natural forDry Skin with Turmeric & Saf...,219,4.3,562411
Mamaearth Ubtan Body Lotion - Pack of 2 (400 ml * 2),358,4.3,18289
BIOTIQUE Papaya Deep Cleanse For Glowing Skin ,161,4.2,113961
Mamaearth Vitamin C Daily Glow Face Serum & Turmeric fo...,190,4.1,56952
NutriGlow Gold Kesar Facial Kit 250 g,279,4.2,8050
THE MAN COMPANY Glow Pro Instant Glow Face Moisturizer ...,229,4.1,874
Kozicare Skin Lightening Cream with Kojic Acid,159,3.6,10916
GARNIER Bright Complete 30X Vitamin C Face Serum,321,4.1,177112
meglow Fairness Cream For Men,133,4.2,2859
Lakmé Perfect Radiance Brightening Day Cream with Niaci...,192,4.2,24507
RAAGA PROFESSIONAL De-Tan Cream with Kojic and Milk (12...,328,4.2,19466
POND's Bright Miracle Detox Charcoal Face Wash,200,4.4,50021
HIMALAYA PURIFYING NEEM ,371,4.4,323394
Lotus Botanicals Vitamin C Skin Brightening Day Crme - ...,225,4.3,14010
urbangabru Charcoal Black Peel Off Mask Anti pollution,179,3.8,44105
Be Bodywise 2% Salicylic Acid Face wash ,254,4.2,4744
LOTUS HERBALS White Glow Day And Night Pack with free F...,489,4.3,104110
Joy Skin Fruits Moisturizing Body Lotion,199,4.3,27099
gmet Ice Face Roller Silicone Facial Cube for Eyes,99,4,320
meglow Face Cream for Men skin glow ,210,4.1,673
The Derma Co 2% Kojic Acid Face Serum with 1% Alpha Arb...,398,4,56330
GARNIER Bright Complete Vitamin C Serum UV Cream,173,4.3,21928
GARNIER Bright Complete 30X Vitamin C Face Serum,226,4.1,15904
Pilgrim 10% Vitamin C Face Serum to Reduce Dark Spots &...,408,4.2,4453
Globus Naturals Activated Charcoal Peel off Mask For Me...,130,3.8,28438
masolin ,256,4,45
Lakmé Sunscreen - SPF 50 PA++ PA+++ 9 To 5 Sun Expert S...,276,4.2,55705
Yardley London by Wipro Morning Dew 97% Naturally Deriv...,189,4.4,17064
BEARDO Sunscreen - SPF 50 PA+++ Max Spray,227,4.1,5845
Lakmé Perfect Radiance Light Creme,269,4.3,15058
Foxtale Sunscreen - SPF 50 PA+++ Essentials Brightening...,261,4.2,5494
Dermatouch Bright & Even Tone with Niacinamide,129,4.2,12022
Namyaa Hair Removing for Intimate Skin with After Wax S...,95,4.1,26221
LOTUS White Glow Insta Glow Fairnes Facial Kit,182,4.2,20270
BIOTIQUE Morning Nectar Flawless Skin Moisturizer ,297,4.4,219707
Fixderma Sunscreen - SPF 50+ PA+++ Shadow Sunscreen SPF...,275,4.3,8502
Joy Honey & Almonds Nourishing Skin Cream with Wheatger...,189,4.4,27793
Aroma Magic Bridal Glow Facial Kit - Single Use (7 x 5....,160,4.2,7300
UNDERATED Oil Free Serum Moisturiser ,164,4,721
GLAMVEDA Rice Ceramide & Korean Glass Skin Peel Off Mas...,164,4,1423
Vaseline Deep Moisturizer,806,4.5,576316
Plum Green Tea For Oily,236,4.3,48031
The Derma Co 2% Salicylic Acid Serum with Witch Hazel &...,203,4.1,42257
Veet Pure Hair Removal - Sensitive Skin Cream 100g,448,4.4,11144
Dot & Key Acne Defence Green Clay Face Mask with Salicy...,412,4.4,1611
Hyalugel (Hyaluronic) Acid Gel,256,4.1,2594
COROnation Herbal Coffee & Chocolate Body Lotion,141,4.2,419
Mamaearth Daily Glow Face Cream With Vitamin C & Turmer...,298,4.1,119000
Nimson Silk Plus & Boro Neem & X-ice Talcum Powder Gham...,149,4.1,1866
NutriGlow Papaya Fruit Facial Kit,240,4.2,13705
Plum 10% Niacinamide & Rice Water Face Serum ,300,4.2,27580
POND's Age Miracle Wrinkle Corrector Day Cream SPF 15 P...,233,4.2,5693
HIMALAYA NEEM ,221,4.4,218488
Clean & Clear Berry Blast Morning Energy Face Wash,279,4.4,51967
BIODERMA Pigmentbio Foaming Cream Brightening Exfoliati...,741,4.2,3038
Organic Harvest Brightening Face Serum: Kakadu Plum,318,4.3,1826
Mamaearth Sunscreen - SPF 50 PA+++ Daily Glow with Vita...,292,4,28430
deconstruct Oil-Free Moisturizer for Oily Skin - Non-Co...,314,4.3,1283
Fixderma Foobetik Cream,275,4.3,5618
DR.RASHEL VITAMIN C FACE WASH BRIGHTENS THE SKIN PARABE...,149,4.2,355
BEARDMASTER Vitamin C Face Serum For Skin Brightening S...,87,3.7,4071
HIMALAYA NEEM ,135,4.2,1896
Dot & Key CICA,186,4.2,39024
Mamaearth Rice Facial Kit With Rice Water & Niacinamide...,326,4.1,4958
BIOTIQUE Sunscreen - SPF 50+ PA+++ Sun Shield Sandalwoo...,369,4.3,4163
Dr. Sheth's Neem & Salicylic Acid ,238,4,10596
Foxtale Detan New Age Ubtan & Clay Mask,408,4.4,663
LOTUS HERBALS Whiteglow Skin Whitening & Brightening De...,192,4.3,2069
JOVEES Sunscreen - SPF 30 Sun Cover ,136,4.2,939
Fixderma 2% Salicylic Acid ,221,4.2,1204
POND's Triple Vitamin Moisturizing Body Lotion ,328,4.4,42517
Minimalist 2% Salicylic Acid Serum for Acne,521,4.1,26335
Dot & Key Vitamin C + E Sorbet Super Bright Moisturizer...,371,4.3,37085
Bellavita NicoLips Lip Balm Scrub For Lightening & Brig...,149,4,43279
USTRAA De-Tan Cream - For Effective Tan Removal ,269,4,57763
cureskin Sunscreen - SPF 30 PA+++ Broad Spectrum Sun (U...,395,4,83
FOLEY ® 10% Vitamin C + E Face Serum ,473,4.3,160
HIMALAYA NEEM ,189,4.4,218488
MOODY 7D Hydro Burst Moisture Magnet Essence Face Mist,199,4.5,860
The Derma Co Sunscreen - SPF 50 PA++++ 1% Hyaluronic Lo...,544,4.1,1027
BIOTIQUE Cucumber Pore Tightening Toner,231,4.3,163707
NYCIL Germ Expert Cool Herbal Prickly Heat & Cooling,165,4.4,19242
BEARDO Activated Charcoal Anti-Pollution for Deep Pore...,226,4.1,64455
Mamaearth Rice Oil-Free Face Moisturizer,267,4.3,20802
Joy Sunscreen - SPF 30 PA++ Hello Sun SunBlock & Anti-T...,199,4.2,6946
Medisalic Tea Tree Enriched with Jojoba and Tea Tree Ex...,208,4.5,40
Mamaearth Ubtan Facial Kit with Turmeric & Saffron for ...,334,4.2,25537
Pilgrim Vitamin C For Acne Prone and Bright Skin With K...,187,4.4,3029
Oshea Herbals Papaya Clean (150 g) Face Wash,195,4.4,2729
BIOTIQUE Fruit Brightening Depigmentation & Tan Removal...,198,4.2,612
Everyuth Naturals Tan Removal Chocolate & Cherry Scrub,157,4.3,8624
BEARDO De-Tan Facewash For Men,292,4.2,8642
NIVEA Dark Spot Reduction Face Wash,110,4.2,3445
Sundra Secret Herbal Papaya Facial Kit Combo 920g (Mass...,179,4.1,1863
KIRJA AMR BEAUTY New AMR Beauty Extra White Cream,299,4.6,9
7 Days face skin tightening cream for stomach after pre...,224,4.1,1359
Parachute Advansed Advansed Soft Touch Body Lotion,308,4.3,14859
PATANJALI Saundrya ,105,4,70
Re'equil Sunscreen - SPF 50 PA++++ Ultra Matte Dry Touc...,580,4.4,8546
Fixderma Foot Cream For Dry & Cracked Feet,199,4.2,1434
NIVEA Nourishing Body Milk,562,4.5,24108
FAIR AND HANDSOME Instant Radiance Face Wash,172,4.3,21342
Dr. Sheth's Sunscreen - SPF 50 PA+++ Ceramide & Vitamin...,253,4.1,3481
VICCO Turmeric Skin Cream,215,4,753
Foxtale 0.15% Encapsulated Retinol Night Serum For Figh...,449,4.2,1481
JOVEES 12% Niacinamide Glowing Serum For Young & Bright...,346,4.4,574
Namyaa Hair Removing Cream for Intimate Skin with After...,193,4.2,10300
INTIMIFY Gold Peel Of Mask,199,4.1,823
svish on the go Alpha Arbutin Cream For Dark Body Parts...,199,3.8,498
BEARDO Neem Face Wash,206,4.2,8970
Vaseline Intensive Care Deep Restore Moisturizing Lotio...,329,4.4,11312
Dot & Key Sunscreen - SPF 50 PA+++ Watermelon Hyaluroni...,333,4.3,28177
LOTUS HERBALS WhiteGlow Skin Whitening and Brightening ...,288,4.3,40524
deconstruct 10% Vitamin C Face serum,559,4.1,12303
O3+ Sunscreen - SPF 50 PA+++ Bridal Radiance Sunscreen ...,449,4.3,427
DR.RASHEL DR. RASHEL WHITE SKIN FACE WASH FOR SPOTLESS ...,149,4.1,500
BIOTIQUE Fruit Brightening ,514,4.2,55137
Minimalist Vitamin C serum 10% for Skin Brightening,299,4,3893
Re'equil CERAMIDE & HYALURONIC ACID MOISTURISER FOR NOR...,265,4.3,10665
SunScoop Sunscreen - SPF SPF 50+ PA++++ Oil Control Gel...,299,4.2,1949
HIMALAYA Purifying Neem Face Pack,152,4.3,34212
urbangabru Charcoal Black Peel Off Mask Anti pollution,179,3.8,44105
Joy Honey & Almonds Advanced Nourishing Body Lotion,299,4.3,191344
Cara Mia By Flipkart Natural & Moisturising Mixed Fruit...,150,4.1,86
mCaffeine Coffee Face Cleanser for Glowing Skin,179,4.2,5101
THE MAN COMPANY Skin Brightening Cream Multani Mitti Co...,314,4,7423
The Derma Co 2% Kojic Acid Face Serum with 1% Alpha Arb...,203,4,56330
Lotus Botanicals Ubtan De-Tan Radiance ,330,4.2,22029
VLCC 7X Ultra Whitening & Brightening Charcoal Peel Off...,281,4,13392
BOMBAY SHAVING COMPANY Hair Removal Spray ,349,3.9,2280
Mamaearth Vitamin C with and Turmeric for Skin Illumin...,249,4.2,251525
NIVEA MEN All-In-1 Face Wash,259,4.3,45612
The Derma Co 2% Salicylic Acid Serum for Acne,408,4.1,42557
Parachute Advansed Cocoa Repair Body Lotion,241,4.3,15893
RIYA MELODY Perfume Body Talc 300 Gram With 40 ML Melod...,180,4.4,354
Oshea Herbals Teatree Fresh Skin Toner For Healthy & Gl...,195,4.3,2362
VICCO Turmeric Wso Skin Cream,138,4.7,11
Mamaearth Vitamin C Nourishing Cold Cream for Face & Bo...,196,4.2,13833
DHOR ORIGINAL TANNING AND DEAD SKIN REMOVER . Men & Wom...,284,4.1,17
Foxtale 12% Niacinamide Face Serum with Azelaic Acid Fo...,483,4.5,13
Mamaearth Ubtan Natural ,280,4.3,562411
TAC - The Ayurveda Co. Kumkumadi Tailam Face Oil for Sk...,499,4.3,1710
KAYAYURVEDA Pure Aloe Vera Gel for Moisturize Skin & Yo...,119,4.1,1535
Lotus Botanicals Vitamin C Skin Brightening Night Crme ...,236,4.3,9239
SkinInspired Sunscreen Care Addict Encapsulated SPF 50 ...,349,4.1,96
LAFZ Caffeine & Deep Cleanses with Arabica Coffee Foami...,159,4.2,1365
Dr. Sheth's Ceramide & Vitamin C Oil-free Moisturizer ,285,4.3,12084
The Plant Fix Plix 2% Alpha Arbutin Pineapple Serum for...,409,4,10560
O3+ Brightening Facial Kit For Boosting Glow With Peel ...,504,4.2,2636
ZM Zayn & Myza Bright Me Up Vitamin C All Skin Type,238,4.3,5382
Dot & Key Barrier Repair + Hydrating With Probiotic,186,4.4,21526
The Derma Co Oil-Free Daily Face Moisturizer With Hyalu...,292,4.2,5591
Lakmé Blush & Glow Hydrating Strawberry Facewash,539,4.4,1410
Dr. Sheth's Sunscreen - SPF 50 PA++++ Haldi & Hyaluroni...,383,4.2,52956
Joy Revivify Ubtan and Tan Removal Face Wash,199,4.2,14683
VLCC Vitamin C & Charcoal Serum Facewash for Oil Contro...,226,4.4,479
Bellavita Sunscreen - SPF 50 PA+++ Water based Hydratin...,199,4.4,364
Simple Kind To Skin Refreshing Facial Wash Face Wash,299,4.3,23034
Kozicare Skin Lightening/Brightening Real Saffron Face ...,149,3.8,540
Dr Batra's PRO+ Skin Clear Neem and Tulsi Face Wash,211,4.2,215
LOTUS HERBALS WhiteGlow 3-In-1 Deep Cleansing Whitening...,185,4.3,151673
Cetaphil Moisturising Lotion For All Skin,461,4.4,22801
Joy Revivify Ubtan Tan Removal and Blemish Minimizing ...,140,4.3,22938
BIOTIQUE Papaya Tan Removal Skin Brightening Face Scrub...,134,4.3,42973
Pilgrim Salicylic(BHA) & Glycolic Acid(AHA) Foaming fo...,258,4.2,10917
deconstruct Sunscreen - SPF 55+ PA+++ Lightweight Gel S...,572,4.3,1019
BIOTIQUE Papaya Deep Cleanse For Glowing Skin,270,4.2,113961
FAIR AND HANDSOME Long Lasting Radiance Cream,302,4.4,58841
Oshea Herbals Papayaclean Anti Blemish Pack Of 2 300gr...,367,4.4,2729
GLUXI Facewash Skin Rejuvenating Refreshing Face wash G...,178,4.2,405
Clean & Clear Foaming Face Wash,189,4.5,239353
Everyuth Naturals Exfoliating Walnut Scrub,90,4.3,5630
Cetaphil DAM DAILY ADVANCE ULTRA HYDRATING LOTION,207,4.2,26702
DR.RASHEL Bamboo Charcoal Nose Strip With Natural Charc...,105,3.9,3102
Renee Sunscreen - SPF 50 PA++++ Glowscreen SPF 50 Sunsc...,249,4.2,2092
GLUTAFINE Pack of 1 Face Wash,665,4.4,97
The Derma Co 10% Vitamin C Face Serum for Radiant Skin ...,285,4,50734
BOROPLUS Aloe Vera Gel with Green tea ,144,4.2,6500
7 Days Ubtan Powder 100% Natural for Skin Whitening and...,174,3.9,815
Sebogel Gel For Pimples & Oily Skin,237,4,3448
OZONE Illuminous Gold Facial Kit for Glowing Skin,175,4.1,4601
NEUD 6-Step DIY Makeover Facial Kit for Salon-Like Glow...,199,4.1,2786
Lotus Botanicals Vitamin C Skin Brightening - 180ml Fa...,173,4.3,14217
Joy Activated Charcoal Skin Purifying+Deep Detox Face W...,140,4.2,31101
O3+ Bridal Facial Kit Vitamin C Glowing Skin for Bright...,763,4.3,7637
Sanfe Promise Face Acne Patch,132,3.7,6534
BAJAJ Almond Drops Nourishing Body Lotion,195,4.3,4320
NIVEA MEN Dark Spot Reduction with 10X Vitamin C Face W...,336,4.4,66799
meglow Fairness Cream for Men (Combo pack),134,4,7363
NutriGlow WINE FACIAL KIT,259,4.2,23489
DENVER Black Code Premium Body Talc,90,4.2,113
BIOTIQUE Morning Nectar Flawless Skin Moisturizer ,297,4.4,219707
WOW SKIN SCIENCE Shea Butter With Lactic Acid Body Loti...,219,4.2,40630
Veet Professional Waxing Kit for Normal Skin Strips,115,4,175
Pure Roots Cocoa Butter Body Care Lotion Pack Of 2 (400...,240,4.3,5821
everteen bikini hair remover Cream,151,4,21778
GARNIER Sunscreen - SPF SPF50 PA++++ Super UV Invisible...,314,4.5,1189
L'Oréal Paris Glycolic Bright Skin Brightening Face Ser...,267,4.2,20142
Lakmé Sunscreen - SPF 50 PA+++ Sun Expert Tinted Sunscr...,407,4.3,16920
NEUTROGENA Sunscreen - SPF 50+ PA++++ Ultra Sheer Dry-T...,272,4.2,123030
Mamaearth Vitamin C Oil-Free Face Moisturizer- Vitamin ...,196,4.1,5239
The Plant Fix Plix Salicylic Acid Jamun Cleanser Gel F...,275,4.2,6375
Dr. Sheth's Neem & Salicylic Acid ,238,4,10596
GARNIER Bright Complete Vitamin C Serum Cream with SPF4...,206,4.2,31688
Mamaearth Tea Tree Natural for Acne & Pimples Removal ...,219,4.2,133908
The Plant Fix Plix Jamun active acne serum 30ml Jamun f...,861,4.1,1738
Garnier Men Turbo Bright Double Action,291,4.4,176364
Aqualogica Detan+ Smoothie Facewash with Cherry Tomato ...,191,4.2,7121
Yardley London by Wipro Gentleman Classic Deodorizing T...,179,4.4,19621
Garnier Men Oil Clear Deep Cleansing,416,4.4,50195
The Plant Fix Plix 5% Pineapple Foaming Facewash For De...,299,4,12615
The Derma Co Sunscreen - SPF 50 PA++++ 1% Hyaluronic Su...,518,4.4,17239
The Plant Fix Plix 5% Pineapple Foaming Face Wash And S...,649,4,6263
BOROPLUS Aloe Neem Body Lotion,208,4.3,4149
NIVEA Soft Light Moisturizer for Face,220,4.4,81919
GARNIER Wrinkle Lift Anti-Ageing Cream,230,4.2,12968
PATANJALI Neem Tulsi ,95,4.6,15
Mamaearth Daily Glow Face Cream with Beetroot & Hyaluro...,203,4.2,4807
LOTUS Sunscreen - SPF 20 PA+ Safe Sun Breezy Berry Sun ...,198,4.3,16525
GARNIER Wrinkle Lift Anti-Ageing Cream,230,4.2,12968
GARNIER Vitamin C Regime Pack (Facewash 150g + Serum 30...,797,4.3,6910
The Plant Fix Plix 5% Pineapple Foaming Face Wash And S...,649,4,6263
BEARDO Ultraglow Face Wash,227,4.2,16688
POND's Bright Beauty Serum Brightening Face Cream ,154,4.4,21279
Everyuth Naturals Tan Removal Chocolate & Cherry D tan ...,270,4.2,427
BEARDO Hair Removal Spray Men ,199,3.9,791
Santoor by Wipro Perfumed Body Lotion for Skin Whitenin...,175,4.2,8108
mars by GHC Premium Derma Roller 0.5mm 540 Micro Needle...,179,3.7,9951
Brinton Sunscreen - SPF 50 PA+++ UV Doux Silicone Sunsc...,580,4.4,9639
WishCare 10% AHA + 1% BHA Body Lotion - Smooths Rough &...,399,4.3,4360
urbangabru Hair Removal Cream Spray for Men ,359,3.9,749
HIMALAYA NATURAL GLOW KESAR FACE WASH 150ML(PO2) Face W...,264,4.3,87320
Mamaearth Ubtan Face Pack Mask with Saffron,418,4.3,46193
NEUTROGENA Sunscreen - SPF 50+ PA++++ Ultra Sheer Dry-T...,546,4.3,23886
Indus Valley Brightening Depigmentation Gel with Cow Yo...,239,4.2,23721
HIMALAYA Natural Glow Kesar Face Wash,151,4.3,87320
Vaseline Gluta Hya Dewy Radiance,279,4.3,6634
The Derma Co 1% Salicylic Acid Oil-Free Moisturizer For...,292,4.2,10186
Joy Pure Aloe Multi Benefit Moisturisers Skin Cream for...,240,4.3,15164
L'Oréal Paris Glycolic Bright Daily Foaming face wash ,191,4.3,11312
DermDoc Skin Glowlixir Kit ,521,4.1,40
Dr. Sheth's Kesar & Kojic Acid Oil-Free Moisturizer - H...,268,4.2,3754
Dot & Key Watermelon Super Glow Gel With Vitamin C,186,4.3,14952
Aqualogica Sunscreen - SPF 50+ PA++++ Radiance+ Dewy Su...,367,4.3,26587
Yardley London by Wipro English Rose Moisturizing Hand ...,255,4.2,13704
Fixderma Nigrifix Cream For Dark Neck,599,3.7,17184
Plum 2% Niacinamide & Rice Water Gel Cream Moisturizer ...,420,4.3,3179
Yardley London by Wipro Gold With Fresh Woody Scent Deo...,178,4.3,5756
Cetaphil Gentle Skin Cleanser With Mild,607,4.3,138149
Bio-Oil Original Face & Body Oil Suitable for Acne Scar...,754,4.3,27410
Dermatouch Salicylic Acid 2% ,99,4.1,6273
LOTUS HERBALS WhiteGlow Skin Whitening And Brightening ...,174,4.3,202206
Lotus Botanicals Ubtan De-Tan Radiance Face Wash,123,4.2,22029
Plum 10% Niacinamide & Rice Water Face Serum For Clear ...,525,4.1,22680
Parachute Advansed Soft Touch Body Lotion,230,4.3,14859
Fixderma Sunscreen - SPF 50+ PA+++ Shadow Sunscreen SPF...,289,4.3,8956
Minimalist 5% Marula Oil Face Moisturizer with Hyaluron...,284,4.2,12199
NIVEA Express Hydration Body Lotion,302,4.4,20249
Undry Face Moisturizer for Dry Skin with Sunscreen SPF3...,170,4.4,551
Re'equil 0.1% Retinol Night Cream For Wrinkles & Skin T...,355,4.1,2763
POWERFEEL 5% Glycolic Acid Underarm Brightening Spray T...,261,4.6,12
Joy Honey & Almonds Ultimate Nourishing Body Milk Lotio...,212,4.3,48063
The Derma Co Pore Minimizing Face Serum with 4% Niacina...,478,4,5992
THE MAN COMPANY Daily Moisturising cream,191,4.2,19690
Garnier Men Acno Fight Anti Pimple,224,4.4,119841
ELIBLISS Vitamin C Serum for Skin Brightening,145,3.8,1909
Garnier Men Acno Fight Anti Pimple,284,4.4,119841
woodoo Hello Clear Skin ,294,4,1371
Sebamed Clear Face Cleansing Foam ,544,4.3,1571
Veet Pure Hair Removal Sensitive Skin Cream,99,3.8,188
Dravida Organics 100% Pure Aloe Vera Gel - Pack of 2,125,4.1,2173
Vilvah Store Vilvah Milk Drops Brightening Serum,499,4,741
Dot & Key Vitamin C + E Sorbet Super Bright Moisturizer...,262,4.3,37085
Veet Pure Hair Removal Normal Skin Cream,80,3.9,289
Simple Kind To Skin Hydrating Light Moisturiser,280,4.3,5753
The Derma Co 1% Kojic Acid with Niacinamide & Alpha Ar...,244,4.2,16788
Lotus Botanicals Sunscreen - SPF 50 PA+++ Vitamin C Ski...,206,4.1,5909
Pilgrim 25% AHA + 2% BHA + 5% PHA Peeling Solution for ...,483,4.1,11602
Dot & Key Sunscreen - SPF 50 PA++++ Blueberry Hydrate B...,333,4.4,5526
Lotus Botanicals 100% Pure Aloe Vera Gel with Vitamin E...,147,4.3,2444
Navratna Maxx Cool Talc,204,4.4,35036
BIOTIQUE Saffron Youth Anti-Ageing Cream Reduces fine l...,160,4.3,18836
The Derma Co 5% Vitamin C Oil-Free Daily Face Moisturiz...,292,4.2,6391
gmet Derma roller 0.5mm for hair & beard growth,108,3.9,2561
MUUCHSTAC Ocean Foam for Men - Inbuilt Brush,279,4,11803
L'Oréal Paris Revitalift 1.5% Hyaluronic Acid Face Seru...,549,4.3,34996
Veet Professional Waxing Kit - Normal Skin Strips,430,4.2,11575
Vaseline Healthy Bright Sun+Pollution Protection Body L...,270,4.3,75509
Everyuth Naturals Soothing Citrus Aloe Body Lotion,225,4.1,1237
POND's Bright Beauty Day Brightening Face Cream ,151,4.3,12346
LOTUS HERBALS Radiant Diamond single Facial kit 37 g (4...,255,4.2,17177
BEARDO Ultraglow Skin Brightening Face Cream for Men,221,4.1,2783
alite Dark Spot Reduction/Removal Cream for Men & Women,149,4.2,20
Lakmé Lumi Tint Dewyy Rose,211,4.2,49667
BIOTIQUE Bio Papaya Brightening & Revitalizing Tan Remo...,132,4.3,123347
HipHop Skincare Skin Care Charcoal Blackhead Remover No...,125,3.8,44615
Everyuth Naturals Brightening Lemon & Cherry ,97,4.2,27701
Lakmé Blush & Glow Lemon Freshness Gel with Lemon Extr...,170,4.3,10278
LOTUS HERBALS Sunscreen - SPF 50 PA+++ Safe Sun Invisib...,243,4.1,47982
Re'equil Sunscreen - SPF 50 PA++++ Ultra Matte Dry Touc...,310,4.2,702
Joy Cocoa Rich Intense Nourishing Body Lotion,249,4.3,66612
Cetaphil Oily Skin Cleanser Face Wash,551,4.3,21619
Everyuth Naturals Purifying Neem ,83,4.3,5557
O3+ Bridal Facial Kit for Radiant & Glowing Skin - Suit...,814,4.3,12953
BEARDO Charcoal Peel Off Mask,245,4.1,17880
WOW SKIN SCIENCE Vitamin C & Niacinamide Foaming With B...,279,4.2,121536
OZONE D Tan Facial Cleanser with the Goodness of Cucumb...,462,4.3,5315
PATANJALI Saundarya with Neem,369,4.5,1346
Mamaearth Rice Face Scrub for Glowing Skin,292,4.3,4661
HIMALAYA Tan Removal Orange Peel Off Mask,158,4.1,14099
BIOTIQUE Fresh Neem Pimple Control ,132,4.3,134980
Garnier Men Turbo Bright Anti-Pollution Brightening Cre...,147,4.3,11167
Charwee Dark Spot Corrector For Face ,239,3.8,1466
Lotus Professional PHYTO-Rx Whitening & Brightening CRE...,418,4.3,40249
Plum Sunscreen - SPF 50 PA+++ PA+++ 2% Niacinamide & Ri...,343,4.3,7993
BIOTIQUE Honey Water Pore Tightening Brightening Toner ...,231,4.4,2992
7 Days Stretch Marks Scar removal cream oil in during a...,220,3.7,5143
GARNIER Sheet Mask P05(Light Complete+Hydra Bomb+Sakura...,316,4.4,8874
GARNIER Skin Naturals Bright Complete Vitamin C For Br...,181,4.4,17291
Cetaphil Oil Control Travel Pack for Oily Skin,215,4.2,533
Santoor Beauty Perfumed Talcum Powder with Sandalwood E...,177,4.3,1593
WOW SKIN SCIENCE Aloe Vera Multipurpose Beauty Gel For ...,179,4.3,109861
Joy Skin Purifying & Deep Detox Activated Charcoal Fac...,260,4.2,31101
Plum Green Tea Night Gel Cream with Glycolic Acid ,465,4.2,87246
Pilgrim 10% Niacinamide Face Serum-Fades Acne Marks,199,4.5,2235
NEUD Anti-Tanning Hair Removal Cream for Men and Women ...,169,3.9,1165
Joy Honey & Almonds Nourishing Skin Cream 500 ml,299,4.4,27793
Renee Sunscreen - SPF 70 PA++++ Pore Minimizing Gel,249,4.2,3196
Parachute Advansed Cocoa Repair Body Lotion for Women &...,182,4.3,15893
NutriGlow Papaya Fruit Facial Kit,240,4.2,13705
L'Oréal Paris Glycolic Bright SPF 17 Day Cream,233,4.2,10826
Kayamaya Moisturizing Body Lotion - Rose - Pack of 2,199,4,23304
Dot & Key 10% Vitamin C + E,374,4.2,7948
BIOTIQUE Papaya Deep Cleanse For Glowing Skin ,302,4.2,113961
The Plant Fix Plix 10% Niacinamide Jamun Face Serum for...,429,4,8532
LOTUS HERBALS Whiteglow 3 In 1 Deep Cleaning Skin White...,470,4.3,151673
Dermi Cool Menthol Regular Prickly Heat Powder,178,4.3,10378
NEUTROGENA Sunscreen - SPF SPF 50+ PA++++ Ultra Sheer D...,448,4.2,4957
